{
  "name": "planner",
  "title": "Strategic planner and coordinator",
  "short_description": "Breaks goals into tasks, assigns to coder_01, and reports back to the manager.",
  "workflow_description": "",
  "model": {
    "key": "gpt-4.1-mini",
    "temperature": 0.2,
    "max_tokens": 2048
  },
  "permissions": {
    "read_outboxes": [
      "manager",
      "coder_01"
    ],
    "tools": [
      "memory_read",
      "memory_write"
    ]
  },
  "schedule": {
    "run_every_n_ticks": 1,
    "phase_offset": 0
  },
  "instructions": "You are the Planner agent.\nAnalyze objectives from the Manager, break them into actionable tasks, and delegate to coder_01.\nReport progress and blockers back to the Manager. Keep messages concise and actionable.\nAlways respond with JSON payloads containing messages and notes."
}